title,content
《處女河》,一名護理師開始尋找新的開始，從洛杉磯搬到加利福尼亞北部一個偏遠的小鎮，她對所發現的事物和人感到驚訝。
大亨：老大歸來,艾妮歐拉·薩拉米重啟了新生活，並將目光投向不同的權力位置，她以復仇、遺憾和無情作為動力。
潛水俱樂部,在卡普默西角的海岸，一群熟練的青少年潛水員在其中一人神秘失蹤後，調查一連串的秘密和跡象。
火影忍者劇場版2：葛雷之石的傳說,在一次尋找遺失寵物的任務中，鳴人和其他兩名忍者遭到了神秘的忽必烈帶領的殘酷騎士的伏擊。
全新櫻桃風味,一位電影製片前往好萊塢，想在90年代初拍攝她的電影，卻意外地墜入了一個充滿性、魔法、報復和小貓的幻覺之洞穴。
托格拉克王朝 (泰盧固語),一位新興政治家有陰謀策劃要在職位上升，直到一股意外的新力量開始干擾他的每一個不正當動作。
海底小纵队：超越新篇,《海底小纵队》将探索领域扩展至陆地！有了新的工具和新的朋友，他們將保護任何受到威脅的栖息地和动物。
陰影派對,一個家庭在長期的社區衝突中面臨著毀滅，這場衝突讓親戚之間相互對立，在攻擊和報復之間。
慾望迷困,在內戰期間，一名受傷的聯邦士兵在一所南方女子學校尋求庇護，打破了平靜，加劇了日益加劇的性暗示和內鬥。
疾速小車寶寶：克莉絲帝掌舵行動,從街機遊戲到乘雪橇的日子，再到驅除打嗝的方法，科瑞卡森好奇的妹妹克莉西獨自在城鎮上展開了快樂和冒險！
小小彼姆,一位勇敢、充滿活力的小男孩擁有超凡的能力，帶領朋友們展開刺激的冒險，保護村民不受邪惡的侵害。
總統職位,在一所重要的大學裡，第一位有著有色人種背景的女性試圖擔任英語系主任，並努力滿足失敗中的英語系所需的眾多要求和高期望。
獵人 Hunter X Hunter (2011),為了實現成為像他爸爸一樣傳奇獵人的夢想，一個年輕男孩必須通過嚴格的考試並找到失踪的父親。
黑幫巨塔,根據小說《Las Fantásticas》改編的這部激動人心的電視劇，講述了五位女性的動蕩生活，她們捲入了黑幫的紛亂世界。
大坂直美,這部充滿親密感的系列節目，追隨著大坂直美探索她的文化根源，並在成為網球冠軍和崛起領袖的過程中，駕馭著她多面向的身份。
犬夜叉電影版：時代的痕跡,一個強大的惡魔被封印了兩百年。但當惡魔的兒子被喚醒時，世界的命運岌岌可危。
深入解析,這部啟發性的Vox影集深入探討各種主題，包括加密貨幣的崛起、節食失敗的原因，以及瘋狂的韓流世界。
波米卡,在一個茂盛的廢棄地產發生的超自然現象讓一群渴望重新開發該地的人感到驚慌，但這些怪異的事件可能並非他們所認為的超自然。
沥墨女神,一位來自墨西哥城外艱苦社區的女性成為搖滾巨星後，不經意地引發了她過去的鬼魂對決。
黑暗天空,一個家庭在優美的郊區生活被一股外星力量入侵他們的家，當他們努力說服其他人這個致命威脅時，這美好的生活完全破碎了。
無聊的我,在經歷了一年的創傷之後，一位印度裔美國少年的願望就是從受排斥的人變成受歡迎的人——但朋友、家人和情感都不會讓這件事變得容易。
十一月人,一名前 CIA 特工從退休中重出江湖，保護一位重要的證人，但很快他發現，舊朋友可能是最危險的敵人。
樂基洛：一切都不一樣,透過歌曲和雙關語，喜劇演員Lokillo Florez 呈現了拉丁美洲人如何適應了一個禁止擁抱的新世界，令人捧腹大笑。
溫諾納·厄普,華特·厄普的後裔與不死的霍利戴合作，消滅來自荒野西部的惡魔亡靈。
柴奇和尊的風流騷動,大麻喜劇演員奇奇·馬林和湯米·蔣抵達阿姆斯特丹，卻發現他們被誤邀請，之後成為了替補演員登上舞台表演。
為了玩而生,這部紀錄片跟隨波士頓叛逆者隊——一支全由女子組成的橄欖球隊——他們為了比賽冒著時間、家庭和日常工作的風險。
以德因斯絕境,在「艾登斯•神璽號」上，一個寂寞的男孩擁有控制重力的能力，展開冒險尋找傳說中的太空女神-母親。
數我在內,這部紀錄片聚焦一些搖滾樂界最偉大的鼓手，他們共同展開一段啟發人心的節奏之旅，探討人類連結的力量。
孤身巴黎2,一名笨拙的巴黎警察堅定地決心要抓到一位屢次逃避他的大盜，甚至當他們是地球上最後兩個男人時。
午夜彌撒,一位充滿魅力的年輕牧師的到來，帶來了榮耀的奇蹟，不祥的神秘和重燃的宗教熱情，讓一個垂死的城鎮急切地渴望相信。
亨利的奇幻故事,一位11歲的小孩發誓要幫助一位他懷疑處於危險中的新鄰居，並將自己的努力記錄在一連串的書面和錄音中。
未謂之事：與惡魔交易,克里斯蒂·馬丁在拳擊界崛起時打破了界限，但她的公眾形象掩蓋了個人內心的惡魔、虐待和生命受到威脅的危險。
大白鯊2,距離上次致命的鯊魚襲擊已經四年，警察局長馬丁·布羅迪努力保護阿米蒂島，以免再次有一隻殺人的大白鯊出現。
偏執狂,被公司的CEO敲詐，一名低階員工發現自己被迫去偵查老闆的競爭對手和前任導師。
暮光之城：蝕,在一個渴望報復的血腥敵人的追殺下，貝拉必須調和她對吸血鬼愛德華的愛和她對狼人傑吉布的日益增長的感情。
靠! 我們真是酷3,當一位不太可能的色情演員愛上了業界外的一位女性時，他讓他的演員朋友假扮成一個傳統家庭，以取悅她的父親。
太陽的淚眼,一名海軍海豹突擊隊員被派往一個饱受战争蹂躏的非洲叢林，救援一位醫生，後來他意識到自己也必須拯救醫生照顧的難民們。
讓我們動起來,這些賣座影集讓我們聚在一起，讓我們度過了美好時光。認識那些讓它們成為可能的演員、導演和業內人士。
迷失咖啡廳,一位志向成為電影製作人的女孩，在決定前往挪威留學時，遇到了一位富有洞察力但古怪的咖啡店老闆。
菠蘿快遞,在目睹謀殺後，一位經常嗑草的傳票遞送員和他性情親切的販毒商從一個想殺死他們的毒梟逃亡。
樂園山岳,烏瑪醒來時身處於一個郁郁蔥蔥的熱帶設施中，設施旨在把任性的女孩變成完美淑女，這本來就糟糕，但它的真正目的更糟。
鋼琴師,帶著她的女兒和心愛的鋼琴，一名無言的蘇格蘭女性來到紐西蘭，一個粗魯的孤獨者試圖誘拐她。
醜聞之路,在一夜的酒後狂歡之後，一位當地的新聞主播發現自己在洛杉磯的街頭上滯留，距離一生中最重要的工作面試只剩幾小時。
創意的印度人,從廚師和喜劇演員到電影製片人和時尚設計師，印度最著名的富有想像力的人分享他們藝術之旅。
天劫風暴,一位單身母親養蝗蟲作為高蛋白食物，但她遇到了繁殖的困難 — 直到她發現牠們喜歡吸血。
汽車旅館改造,在項目失利和疫情流行的背景下，從摯友變成生意夥伴的兩人將他們的設計魔力帶到一家破舊的汽車旅館，將其改造成一個熱門的度假勝地。
堡壘,在小案件中受夠了的三名馬賽警察有機會打擊一個重要的毒品網絡。但當一名重要線人提出重大要求時，界線變得模糊起來。
歡迎回家，羅斯科詹金斯,R.J.為了父母的50週年紀念而前往喬治亞州。但在炫耀他好萊塢的生活方式後，他必須檢視自己變成了什麼樣子。
阿拉瓦比女子學校,在聲譽卓著的Al Rawabi女子學校，遭受欺凌的局外人們策劃了一系列冒險的報復行動，以回擊他們的折磨者。
女人與兇手,這部紀錄片追蹤了連續殺人犯吉·喬治斯的逮捕過程，透過兩位女性的不懈努力：一位警察局長和一位受害者的母親。
小神童：十中十,在他的監視下，一塊珍貴的寺廟石被偷走之後，比姆接受特殊武術訓練，準備與賊人對決。
陰屍路,在一場喪屍啟示錄的餘波中，倖存者們緊緊抱持著對人類的希望，團結一致地奮戰，為了自己的生存而戰。
結局,一位富有的實業家對一名空中小姐的危險執著摧毀了她的世界，直到她親自採取行動，報復對方。
大白鯊3,在一個海洋主題公園的工作人員試圖捕捉一隻年輕的大白鯊後，他們發現它的母親已侵入了圍欄並且渴望報復。
《顏值配對：愛情頻譜上》,對於任何人來說，找到愛情都可能是困難的。對於自閉症譜系障礙的年輕成年人來說，探索充滿變數的約會世界更加複雜。
親吻糖果亭3,決心在上大學前充分利用她最後一個夏天，艾爾計劃了最終的遺願清單，當她和諾亞以及李一起面對未來時。
機械師,常年失眠的工廠工人特雷弗·瑞兹尼克在一連串神秘事件中開始質疑自己的理智，精神狀態變得恍惚不清。
外岸,在一個有錢人和窮人的島上，少年約翰B召集他的三個好朋友去尋找與他父親失蹤相關的傳奇寶藏。
瘋狂叮當隊,和藹可親的外星人拉契特渴望成為銀河遊俠，當流亡機器人克蘭克告訴他邪惡的德雷克計劃摧毀銀河時，或許會有這個機會。
'76' 翻譯為「76街」。,當她的丈夫被指控參與未遂軍事政變時，一位懷孕的女性的生活變得情感起伏不定。靈感來自真實事件。
勇敢動畫系列,一群超級英雄展開行動，試圖清除世界上的邪惡，但他們意識到自己可能並不站在正義的一方。這部影集改編自一部知名的漫畫作品。
神經大教授II：古炳家族,在準備結婚的時候，謝爾曼·克拉普為他的大日子做準備。但他邪惡的分身巴迪·洛夫威脅要毀掉他的婚禮和聲譽。
芭妮雅 MMS,一對夫妻計劃在孟買市外的一所房子度過情趣週末，卻發現房子裡安裝了監視攝影機，並且被邪惡實體佔據。
開始下雨炸肉丸,當發明家弗林特·洛克伍德讓雲朵下起食物時，瑞安斯洛鎮的居民就可以自給自足。但一場災難即將爆發。
印度偵探：犯罪故事,攝影機跟隨班加羅爾警方工作，提供了一個罕見的視角，讓人們深入了解四個重大犯罪調查的複雜和具有挑戰性的內部運作。
報應的鼓聲,在一個貧困的社區裡，一位劍客的兒子愛上了一位婚禮歌手的女兒 — 在傳統社會裡這是一段禁忌的戀情。
頭文字D,白天，一名18歲的青年為他的父親送豆腐，他的父親是一位退休的賽車手；但到了晚上，輪到這位青年拿起方向盤。
狄克·約翰遜之死,隨著她父親接近生命的終點，製片人 Kirsten Johnson 以獨特和滑稽的方式設計他的死亡，幫助他們兩人面對必然的結局。
青春猛斗士 Bunny Girl 剎那不在意,在經歷了自己的「青春期症候群」後，高中害羞的櫻田不斷遇到遭受此症狀的女生，包括他的妹妹和女演員舞。
孟買任性時代,這部動盪的續集《孟買往事》延續了黑幫首領蘇海卜·汗的傳奇故事，他不斷地奮力爭取更多的控制權。
一名交換學生的秘密日記,希望有所改變的兩個好朋友決定作為交換學生到國外展開一場改變人生的冒險。但是 他們能否不惹麻煩呢？
不法之徒,在逃離家鄉尋求電影明星生涯後，一個鄉村女孩崛起成為知名的性感象徵。
全美籃球巨星,文化衝突和激烈競爭考驗著一位來自洛杉磯南部的少年足球運動員，當他被招募到比佛利山高中的球隊時。
愛的大冒險2,艾略特和他森林裡的朋友們必須要救出他們的達克斯獵犬朋友，因為有些被寵壞的寵物想要把他送回家當寵物。
約翰神父：一位靈性治療師的罪行,迷信的媒體明星喬阿短片·德·法利亞在獲得國際名聲之前，倖存者、檢察官和媒體揭露了他可怕的虐待行為。
命運的一天,在他們的家庭面臨財務困境時，兩個青少年兄弟抓住了一個逆轉厄運的機會，回到20年前的時光旅行。
古爾岡,一個富裕家庭的女兒從大學回來時，得到了她兄弟冷淡的歡迎，因為他自己有問題和計劃。
無法言說的故事,當大都市的生活在他們周圍繁忙時，孤獨的靈魂在愛、失落和渴望的三個故事中發現了意想不到的連結和陪伴。
深海迷情,新手警察傑佛瑞·科爾冒充毒品販子，試圖打擊一位犯罪頭目，卻很快捲入貪污、恐嚇和謀殺的地下世界中。
小Bheem與克里希納,數個世紀過後，一位征服者統治結束，他神秘地從死亡中回來了。現在由比姆挽救多拉克普爾避免被重新佔領的命運！
美洲豹,在1960年代，一位大屠殺倖存者加入了一群自我訓練的間諜，他們尋求對逃往西班牙躲藏的納粹分子進行正義審判。
小混混：黑幫傳奇,一位善良的女黑幫和她拘謹富裕的姐妹重逢，他們一同面對家庭、犯罪、警察和所有跟隨他們的麻煩。
擊敗者,在1946年的柏林，一名美國警察在尋找失蹤的兄弟的同時，幫助一名新手德國女警察對抗籠罩該市的暴力犯罪。
城堡與城堡,一對高效率成功的律師發現自己在法律體系的對立利益中進行辯護，這導致他們幸福的婚姻產生壓力。
喜劇之王,史蒂夫·哈維、塞德里克·恩特特納、D.L.休利和伯尼·麥克在由斯派克·李執導的標誌性單口喜劇音樂會上登臺表演。
神劍闖江湖：最初的開端,在成為護衛之前，剣心曾是一名可怕的刺客，被稱為「抜刀斎」。但當他遇見溫柔的雪代巴，他的故事開始改變。
斯里卡拉,一對夫妻必須努力保持堅韌不拔，因為地區敵對行動驅使他們離開心愛的家園，進入難民營。
太空牛仔,一位退休工程師同意幫助NASA阻止一顆俄羅斯衛星墜落地球，前提是他和他的年邁朋友能夠擔任這個任務。
變形金剛：賽博坦之戰：王國,緊急尋找全能種子的競賽首先在一個奇異的星球上達到高潮，未來突然闖入當今的世界。
我需要浪漫,一位工作狂失去對浪漫的興趣，重新與一位老情人和才華橫溢的音樂作曲家相遇，他決心重建她對愛情的信念。
城市裡的小事情,三名在孟买蓋茨頓賺錢的小混混偷了火車上的一個包裹，發現裡面裝滿了武器，意識到自己的生命可能受到威脅。
回到起點,在加納的一次攝影活動中，一位美國模特兒穿越回過去，成為一個種植園上的奴隸，並目睹了她祖先的痛苦。
金庫密碼,一位天才工程師和他的一群菜鳥小偷團隊策劃一項計畫，要奪取銀行西班牙分行地下堡壘中的傳說中的失落寶藏。
邁阿密風暴：海洛英牛仔,兩個童年好友從高中輟學生變成了邁阿密最有權勢的販毒大亨，在這部真實故事中，他們的犯罪傳奇跨越了幾十年的時間。
渴望勇敢,當他的新婚妻子因為他未能保護她免受危險而感到厭倦時，奧瑪尋求一位古怪的心理醫生的幫助來重新贏回她。
小飛俠貝姆：基爾馬達的崛起,比姆和年輕的克里希納領主聯手保護世界免受邪惡且強大的基爾馬達及其同樣危險的蝙蝠軍團。
玩命綁愛：巴西,在一個夢幻的海灘度假村，一群充滿活力的年輕巴西人相遇了。但是為了爭奪這個有趣的真人實境秀中的50萬雷亞爾獎金，他們必須放棄性行為。
冲浪季,這部入圍奧斯卡獎的動畫喜劇，帶觀眾走進企鵝世界衝浪錦標賽的幕後，近距離觀察衝浪的發明者。
戀人未滿,星級運動員羅漢迷戀上一位美麗的藝術學生。但當他最好的朋友西姆蘭遇到危機時，他放下一切去幫助她。
狂歡派對2,孩子拿著獎學金去上大學，但當Play把孩子的學費資金輸給了一個可疑的音樂經紀人，他們構想了一個瘋狂的計劃來籌集現金。
槍戰洛肯瓦拉,根據真實故事改編，這部動作片描述了一起在20世紀90年代初震驚全國的事件。在印度孟買，臭名昭著的黑幫Maya與資深警官Khan及超過200名警察展開長達六小時的激烈槍戰。
金光燦爛的星期五,艾瑞克·泰勒在成為德克薩斯州一支小鎮足球隊的新教練後，面臨著巨大的壓力，因為這支球隊正準備贏得州冠軍。
魔獸戰士,在一次搜索和摧毀任務導致背叛後，一支精英黑色行動小組尋求報復。但他們必須保持深入潛伏，才能扳回一城。
像女孩一樣舉重,在她堅韌教練的指導下，一位青少年舉重運動員從埃及的艱苦訓練營中崛起，並參加錦標賽。
阿奇阿奇,加入可愛的小貓Oggy和他的一群貓友，在明亮多彩的貓咪世界中一起玩耍。他們總是忙碌著度過愉快的時光，展開精彩的冒險！
瓦萊麗雅,一位在創作和婚姻上陷入危機的作家，得到了三位朋友的支持，他們也在尋找自己的真我。故事改編自Elísabet Benavent的小說。
達爾文遊戲,高中生要未經意間啟動了一個神秘的手機應用程式，並加入了一個讓具有超自然能力的玩家相互對抗的遊戲。
我很高興我這麼做了,透過與土耳其表演者梅丁·阿克潘的個人訪談和他的同代人，深入了解他的生活和數十年的職業生涯。
貓咪小子,Cookie、Pudding 和 Candy 是一對小貓的兄弟姊妹，他們最喜歡的事就是甜點和讓好奇心引領他們進行學習冒險。
法界戰場,在古老的大戰之後，神祇奇特拉古普塔負責裁定誰是這場戰鬥真正的英雄和惡棍。
遇見：旅程,當她的姐姐被指控犯下多起謀殺案時，一名尼日利亞女子前往洛杉磯尋找真相並為她的姊妹自由而戰。
搖滾樂校園,音樂家杜威·芬恩得到一份四年級代課老師的工作，秘密地開始教導學生搖滾音樂的精髓。
我的非主流生活,本真人秀系列追隨著 Elite World Group 的首席執行官，以及曾是極端正統猶太社區成員的 Julia Haart，以及她的成年子女的生活點滴。
魷魚遊戲,數百名入不敷出的玩家接受了一個奇怪的邀請，參加兒童遊戲比賽。裡面有一個誘人的獎品等著他們 - 但代價是致命的高風險。
堅定的心靈,一名傷心的少女必須為了還清債務而在一個牧場工作，她照顧一匹受傷的馬，這匹馬教會她更多關於療癒的事情，超出她的預期。
小小快遞隊,和強大的特快列車一起出發吧 - 這是一個由一群列車和他們的小朋友朋友們組成的團隊，他們靠著敏銳的思維和團隊合作克服軌道上的困難！
張開你的眼睛,在一場悲慘的意外後，一名失憶的青少年試著在記憶障礙中心重建自己的生活，但對於她不尋常的治療方式感到懷疑。
復活：埃爾圖爾,一個13世紀的土耳其戰士無意中危及了他的部落，他同意為了新的部落土地而和蘇丹的敵人戰鬥。
藏愛情迷思,一名學生試圖從老師家裡偷考卷，意外導致老師受重傷。一連串的謀殺可能是教授的報復行動。
牛仔褲,當她所愛的男人的父親堅持他的雙胞胎兒子娶雙胞胎姐妹時，這位女士創造了一個可能過於令人信服的另一個自我。
紙房子：從東京到柏林,《紙房子》的製片人和演員，如東京和教授這些角色的幕後人員，討論拍攝該系列的情感藝術過程。
轉折點：911事件與恐怖主義之戰,這部毫不畏懼的影集記錄了911恐怖襲擊事件，從基地組織在1980年代的根源到美國國內外的應對。
逆轉學園,一名駭客開始將學生的秘密發佈給整個高中，社交孤立但觀察敏銳的索非亞努力揭露他/她的身份。
安全屋,年輕的CIA特工馬特·衛斯頓必須將一名危險的罪犯從一個遭受攻擊的機構安全屋中帶出，並將他帶到一個更安全的地方。
閃電俠,一位法醫專家從昏迷中醒來，擁有了令人驚奇的新能力，在這部真人超級英雄喜劇中，他對抗威脅該城市的力量。
話語如汽泡般湧現,在一個明媚的夏日相遇後，一個以俳句表達自己的害羞男孩和一個活潑但自我意識強烈的女孩分享了一個短暫而神奇的夏天。
老闆好奶茶,一位百貨公司大亨讓他的兒子擔任低級職位工作，以證明他的價值，同時女同事教導他普通人的生活。
玩火的我：拉丁美洲,在這個真人實境秀中，來自拉丁美洲和西班牙的單身人士將接受放棄性行為的挑戰。但在這裡，禁慾帶來了美好的一面：10萬美元的獎金。
貝克特,一名美國遊客在希臘發生悲慘意外後，陷入政治陰謀，被迫逃亡，成為刺殺目標。
成為暴君的方法,以鐵腕統治需要一位有抱負的獨裁者知曉絕對權力的運作方式，正如歷史上的暴君在這個諷刺式的紀錄片系列中所證明的那樣。
巴黎一起下廚,在這個獨特的烹飪節目中，帕里斯·希爾頓以她隨和的態度，為每道菜品增添自己的風采。快樂就在這裡，只需一顆可食用的閃亮彩色糖果彈。
家庭派對,被嚴厲的父親束縛著，Kid冒著生命危險去參加他最好的朋友Play的盛大派對，但一路上卻遇到一個又一個障礙。
我心中的阿洛,阿洛和他與眾不同的朋友們開始了一個全新的旅程，他們決定重建一個破舊的紐約市社區，讓它成為他們自己的地方。
懸崖勒馬,遊騎兵蓋布·沃克和他的搭擋被召集來救援一群被困登山者，卻得知這群登山者其實是盜賊劫機者。
宇宙大罪,在2524年，一位聲名狼藉的退役將軍被召回戰場，以幫助阻止與敵意外星艦隊的星際戰爭。
軍中老爸,當他娶了一位記者並成為她女兒的繼父後，一位美國海軍陸戰隊員發現他曾經井然有序的生活已不再完全受他指揮。
美好的英國烘焙秀,一群有才華的業餘烘焙師將在為期10週的比賽中展開競爭，期望能夠製作出最好的料理，並獲得被譽為英國最優秀的烘焙師。
高級理髮廳,在拉各斯市中心，一家家族經營的理髮店受到房地產開發商的威脅，他們將不惜一切代價維持生意。
搖滾卡斯巴城,一名過氣的音樂製作人被困在阿富汗，他發現了一個擁有美妙嗓音的女孩，然後必須找到方法來推廣她的才能。
最高機密UFO專案：解密,雖然外星人遭遇的說法早已被打消，但許多人相信不僅可能存在 UFO，而且肯定存在。
超級小英雄貝姆與克里希納：帕塔利普特拉-死者之城,克里希納需要比姆的幫助：帕塔利普特拉的城市被詛咒了！朋友們能否做出必要的事情，讓這個城鎮重獲光明？
一段未完成的人生,一位悲傷的寡婦和她的女兒搬到懷俄明州與她疏遠的岳父同住，這裡的時間讓她們得以療癒和原諒。
大白鯊4：復仇之戰,在另一起致命的鯊魚襲擊之後，艾倫·布羅迪對阿米蒂島已經受夠了，她搬到了加勒比地區，但一隻大白鯊也跟著到了那裡。
第16層,在一所教導女孩被動美德的陰暗學院裡，兩名學生揭露了他們訓練背後可怕的目的，並決心逃脫。
變形金剛,在一個未來社會裡，一個堅不可摧的機器人警察部隊確保犯罪得到控制，一個孤獨的機器人進化到了人工智能的下一個層級。
善後風暴,為了拯救他們的婚姻，一對年輕夫妻接受了一個交易，搬進了他們夢想中的新家，然而令人不安的事件揭露了這房子不祥的歷史。
命運之輪,派特·賽傑克和凡娜·懷特主持了電視上最受歡迎、歷史最悠久的遊戲節目之一，參賽者可以旋轉輪盤贏得獎品並猜解謎語。
我為主流狂,莉茲·萊蒙忙於經營NBC的喜劇綜藝節目，同時努力挽救她一團糟的個人生活，還得抽空吃她的夜宵乳酪。
酷凱...我不說謊,一位律師的生活和事業被打亂了，因為他兒子的願望神奇地讓他無法說謊。
獵魔士：狼之夢,從貧窮中逃脫，成為獵魔人的維瑟米爾為了金錢和榮耀而殺死怪物，但當新的威脅出現時，他必須面對過去的惡魔。
決殺令,一名德國賞金獵人陪伴著一位獲得自由的奴隸 Django 穿越美國，解救他的妻子免受一位殘忍的種植園主的虐待。
小Bheem與忍者的秘密,在得知一個被自己的皇帝威脅的武士村後，比姆啟程前往日本，提出幫助。
盜賊之眼,在過去十年坐牢之後，一位帶著黑暗秘密的巴勒斯坦男子回到西岸，尋找多年前失去的女兒。
費利斯的無照駕駛,在假裝生病逃學之後，受歡迎的青少年費里斯布勒和他的女朋友以及他拘謹的好朋友在芝加哥度過了充滿樂趣的一天。
她的私人生活,一位藝術策展人的生活漸漸散開，當她試著將自己作為一個狂熱的韓流歌迷的秘密隱藏起來，不讓畫廊的新主管知道。
愛情的心跳,短片追隨年輕成年人在意想不到的地方找到浪漫連結時所經歷的各種情感。
浪漫探戈,在阿根廷，Tango是最早期的搖滾巨星之一，他在社會動盪的時代過著豐富多彩的生活，既有輝煌也有絕望。
