title,content
巨怪獵人：泰坦之戰,從《巨魔獵人》、《3Below》和《巫師》中，英雄們聯合起來對抗一個威脅要佔領他們的世界，甚至重置地球的陰影敵人。
花季少女,一名長期夢想著自己的婚禮的年輕花店女孩被男朋友甩掉後，決定尋求一位英俊演員的幫助，試圖重新贏回男友的心。
奧斯莫西斯瓊斯,彼得和鮑比·法利利超越自己，這部部分動畫的故事講述一個身體不好的40歲男人，他的身體裡寄生著各種生物。
小Bheem：從多拉庫爾到加德滿都,當比姆在尼泊爾度假時，事情出乎意料地轉變，因為他被要求拯救一隻猴子幼崽，使其逃離雪豹的追捕，並與父親團聚。
與我不同的同類,一對婚姻岌岌可危的富有夫妻誤交當地一名無家可歸的男子，他改變了他們的觀點，在這個鼓舞人心的真實故事中。
深藍之海,科學家研究鯊魚，希望找到治療阿茲海默症的方法。但一個危險的捷徑導致出現了擁有接近人類智慧的巨大鯊魚。
沈重,胖子維克多在他母親陰暗的酒吧裡做披薩，躲避世界，直到一位新女服務生的到來打破了他的孤獨。
派對之後的人生,凱西熱愛派對...直到她在一場意外中離世。現在這位社交蝴蝶需要在地球上彌補自己的錯誤，如果她想要賺取她的天使之翼。
致命的愛情,一名商業主收到網上威脅後，當她重新和一位從前的戀人聯絡，並遇見一位新客戶時，產生了懷疑和偏执。
李秀根：感官教練,李洙根在韓國喜劇界崛起的過程中，一直擅長捕捉社交暗示。現在，他準備分享自己的知識和技巧。
鍾情煙雲,當香港政府禁止室內吸菸時，這項新法令迫使熱衷吸菸的人到室外，也促成了一些不太可能的人際關係。
砲手派恩,一名鐵骨鐵肚的海軍陸戰隊員接到了下達的命令，現在必須帶領一群不合群的不同類型的學員參加青少年預備軍訓練團競賽。
火星攻擊!,隨著飛碟朝地球飛來，美國總統準備歡迎外星訪客，但很快就得知他們並不是和平來客。
蓋比的洋娃娃屋,可愛的貓咪、古怪的手工藝和繽紛的魔法！加入貓咪愛好者蓋比和她的搭檔潘迪波斯，一起展開一系列的動畫冒險。
未講述：凱特琳·詹納,凱特琳·詹納(Caitlyn Jenner) 不可思議的奧運光芒啟發了人們。但她更具挑戰性的追尋真我之路更顯得更有意義。
狂歡派對3,在小孩訂婚後，普雷計畫舉辦有史以來最盛大的單身派對。但是這兩個人的每次慶祝活動總是伴隨著各種麻煩。
煥發斗志,在這個競賽節目中，有抱負的化妝師將應對各種色彩挑戰，爭取在美妝行業贏得一個事業的契機。
舒馬赫,透過獨家訪問和檔案影片，這部紀錄片描繪了七屆一級方程式冠軍迈克尔·舒马赫的親密肖像。
伊斯坦布爾任務：勇敢之後是勝利,一位電視記者冒著風險接受來自爭議性伊斯坦布爾電視台的工作機會，進行職業生涯上的重大轉變。
非洲裔美國人,一名不滿的南非女性離開她的未婚夫，從她的工作中盜用金錢，追求她在紐約市成為百老匯明星的夢想。
犬夜叉電影3：正義之劍,偉大的犬妖留下了牙的三劍中的一把給他的兩個兒子。現在第三把劍的邪惡力量已經被喚醒。
愛情無法擋,厭倦了帶著她的好朋友在約會場景中翻來覆去，一個迷人但又笨拙的女人，患有一種罕見的遺傳疾病，將她的目光投向了愛情。
馬津長子艾莉茲：一場犯罪的故事,這起犯罪震驚了巴西：艾麗澤·馬松納嘉（Elize Matsunaga）開槍並肢解她富有的丈夫。這部紀錄片系列深入探討這個案件，並首次呈現她的專訪。
價值,在911事件後，一名律師在試圖為失去的生命做價值評估時，面臨情感上的調整。故事改編自真實事件。
自由作家,在她那些有風險的學生閱讀一些經典作品，比如《安妮日記》的時候，一位老師要求他們寫日記，記錄他們困擾的生活。
遙遠的土地,在法羅群島，一名已婚婦女遇見了一名拍攝紀錄片的記者，他們正在拍攝一部關於海外菲律賓勞工的紀錄片，很快地就引發了一段複雜的愛情故事。
44隻貓,《毛茸茸麥克斯樂團》故事中充滿了令人驚嘆的故事，當唱歌的毛茸茸朋友Lampo、Milady、Pilou和Meatball聚在一起時。
天馬魯斯,八年前，一名年輕男子被陷害犯下謀殺案，一位新興的律師重新打開了這個案件，展開了一個艱鉅的任務，尋找真正的罪犯。
宇宙霸主：啟示录,在一場災難性的戰鬥之後，埃特尼亞遭受重創，提拉和一個不太可能的聯盟必須阻止宇宙的毀滅，這是80年代經典作品的續集。
SAS：黑天鵝的崛起,一名特種部隊成員與女友從倫敦前往巴黎，當武裝無情的僱傭兵控制了他們的火車時，他立即採取行動。
兩個父親,兩個單身男子得知他們曾經和同一位女性發生關係，後來女性在生下孩子後消失了，他們決定一起共同抚养這位女孩，成為一個家庭。
小神童的俄羅斯冒險,一台故障的交通機器將Chhota Bheem和他的朋友們帶到俄羅斯，他們必須從一位邪惡、渴望權力的魔術師手中拯救一位公主。
韓國冷麵狂想曲,清新爽口的冷麵是韓國夏天最涼爽的主食。從它的烹飪方式到受到喜愛的歷史之旅展開了。
時光列車,深入了解日本頂尖男偶像團體的美麗世界，這個揭露真相的紀錄片系列將帶你一窺日本頭號製作人總出品的Johnnys公司。
圈子,在這個社會實驗和競賽節目中，地位和策略碰撞，線上玩家們透過調情、交友和假扮來爭取10萬美元的獎金。
田納西州驚悚鬼屋2: 喬治亞的鬼魂,一對夫妻在喬治亞州的夢想之家變成了一場噩夢，因為他們的女兒開始從房產的可怕過去中看到令人恐懼的幻象。
小飆風小武士與破碎的護身符,當一個陌生人試圖從皇宮偷走一個護身符時，比姆得知了該飾物背後的悲慘故事，並前往非洲打敗真正的惡棍。
神經學教授,在被取笑肥胖後，一位善良又聰明的教授服用了一種革命性的藥物，不僅改變了他的外表，也改變了其他方面。
回到Q82,渴望重聚離異的父母，一位發明家的女兒開著他的時光旅行車回到1982年。但一位暗戀者意外地跟隨而來。
非典型家庭,當一名自閉症兒童決定尋找女朋友時，他希望擁有更多自主權，這讓整個家庭都走上了自我探索的道路。
貝多芬的第二號,在聖伯納Beethoven與Missy交配之後，他和紐頓家的孩子們必須干預，因為Missy的主人試圖出售這些小狗。
火影忍者：雪國忍者之戰,火影忍者、佐助和櫻葉得知他們將在女演員拍攝下一部電影時保護她不受傷害，但後來發現她是一位公主。
暮年狂歡會,悼念了他們所喜愛的初中籃球教練的離世，五位中年好友聚集在湖邊小屋，重新發現了童年的快樂。
C小隊,三個身無分文的朋友假裝成黑幫搶錢，但他們的計畫意外地讓他們虛假的公司變得很有名。
51號星球,在一個讓人聯想起1950年代郊區的行星上降落後，一名人類宇航員試著避免被捕獲，找回他的太空船並安全返回家園。
在拉各斯的兩週,一位商人回到尼日利亞的家鄉，愛上了朋友的妹妹，盡管他的家人計劃讓他娶一位政治家的女兒。
屠戮,在追求成功和認同感的過程中，一群精通科技的人士兼顧親密關係、第一印象和浪漫機會。
小飛俠寶爺 & 甘尼許,比姆和象頭神聯手拯救杜拉庫普，抵抗噴火龍的攻擊，並解救象頭神的老鼠夥伴！
王者廚房與其他故事,探索印度地方菜系的歷史和風味，從傳統的克什米爾盛宴到古吉拉特素食菜餚。
孟買,多年前，一對夫妻違背家人意願私奔，如今他們和兒子們陷入了城市的衝突之中。
泰戈爾故事集,諾貝爾獎得主拉賓德拉納特·泰戈爾的作品在這部故事集中變得生動，故事背景設定在20世紀初的孟加拉。
EMI: 要借錢就得還款,一家銀行聘請了一名神秘又古怪的討債人員，來向四名無法還貸的借款人追討款項。
小超人與印加冒險,當多拉克普爾的公主被綁架時，比姆前往因卡帝國拯救她，但是當他到達那裡時，他將面臨更大的挑戰。
點亮生活,在這個真人實境秀中，近藤麻理惠將她充滿喜悅的整理戰術帶給那些在工作和家庭生活間掙扎的人，同時也分享她自己的世界。
勢在必行,四位女性 ─ 一位廚師、一位單親媽媽、一位女繼承人和一位求職者 ─ 在洛杉磯疫情前熱情投入愛情和工作，並夾雜著大量的中年危機。
瀧澤歌舞伎零2020電影,超級巨星滝沢秀明將他著名的歌舞伎製作重新構想為影視作品，並邀請偶像組合Snow Man展現他們的動人才華。
未被告知的：臨界點,在美國網球的傳統中延續勝利壓力下，馬迪·費希面臨精神健康挑戰，這改變了他在球場上和生活中的人生。
露營奇遇营,在 迪士尼熱門影集《傑茜》中，羅斯兄弟姊妹在緬因州的基基瓦卡夏令營度過充滿樂趣和冒險的夏天，這裡是他們父母初次相遇的地方。
刀鋒上,在與調查一名年輕女子謀殺案的警察展開一段風流韻事後，一位與世隔絕的女教師懷疑她的情人與這起犯罪有牽連。
朱麗葉的情書,在意大利威尼斯的美國女子收到一封寄給莎士比亞悲劇女主角茱麗葉·卡普萊特的信後，展開尋找浪漫的旅程。
듰루루 - 小企鵝阿童木,在一個小島上，企鵝寶露露和他的朋友小狐狸艾迪、河狸露露、北極熊波比和恐龍可可一起度過了快樂的冒險。
彩虹,一個熱愛電影的10歲女孩和她失明的弟弟，踏上旅程前往印度，希望得到印度巨星沙魯克·汗的幫助，為弟弟爭取眼睛手術的機會。
此處與彼方,通過社交媒體上的激烈交流相遇後，兩個背景不同的人在疫情期間開始了一段網上戀情。
五呎之間,一位患有囊腫性纖維化的青少年改變了她的日常生活並挑戰醫院的規定，當她愛上了一位病房裡的病患。
靠！這才叫過癮,多年的朋友Rahul和Karan前往孟買，意在實現他們的夢想，但兩人突然遭遇了厄運。
擄兵者,一名年輕的士兵被指派捕捉逃兵，揭露了每位士兵在強制兵役期間所遭受的痛苦現實。
旅遊大世界,米洛斯·克諾爾帶領喜劇演員盧卡什·帕夫拉塞克、托馬什·馬托諾哈、艾斯特爾·科奇奇科娃、米哈爾·卡瓦爾奇克和理查德·內德維德在捷克共和國進行巡迴演出。
綠光戰警,測試飛行員哈爾·喬丹穿上異世界的戒指，發揮閃亮的新力量，幫助星際力量阻止一個強大威脅。
最後一名童軍,私家偵探喬·哈倫貝克被迫與一名聲譽受損的四分衛合作，揭露政客和足球隊老板的陰謀。
媽媽鵝俱樂部,經典的童謠和兒歌在這個高能量的節目中獲得全新的演繹，幫助孩子在跳舞和唱歌中學習。
趕緊抓住我,一名聯邦調查局特工使命在把狡猾的詐騙大師弗蘭克·阿巴格納爾小姐關進監獄。但弗蘭克不僅逃避了逮捕，還對追捕感到愉悅。
最終帳戶,這部紀錄片將從未曝光的訪談串連起來，採訪了參與希特勒第三帝國的最後一代人。
訓練日,一位菜鳥警察只有一天的時間向資深的洛杉磯警局毒品調查人員證明自己，他接受了導師可疑正義觀念的快速培訓。
親愛的約翰,一名美國士兵在暑假時愛上了一名大學生。但當他被迫重新入伍時，他們手寫的信件將這對戀人聯繫在一起。
波賽頓,一股海嘯帶來災難，一艘滿載著新年歡樂遊客的船隻翻覆，巨大的船艦傾覆了，乘客們陷入了一場生存之戰。
菇，驚奇的菇,深入探索神奇的真菌世界，從能清除油污的蘑菇到幫助樹木溝通的地下真菌網絡。
四重奏,為了拯救他們的豪華退休之家，前歌劇明星們計劃舉辦一場盛大的演奏會 — 直到她們中最大的歌劇女高音拒絕唱歌。
泰奧與小巫師,泰勞的朋友被邪惡的魔法師綁架，他為了拯救朋友，踏上了冒險之旅，因為那些魔法師入侵了他們的城市，想要找到一顆神奇的寶石。
冠軍之城高中,在一個喬治亞小鎮上，足球是主宰一切的，贏球至上。一支高中足球隊在爭奪冠軍頭銜的同時，面對愛情、對手和現實生活的挑戰。
我是卡爾,在一起大部分的家人在一次恐怖攻擊中被殺害後，一名年輕女子無意間被誘使加入了殺害他們的團體。
提提波，提提波,提提婆火車準備證明他有能力幫助火車村的人們安全可靠地騎軌。
魔法俏佳人,"在這部動畫奇幻片中，一個名叫布魯姆的女孩和一群仙女成為朋友，然後跟隨她們進入神秘而危險的""魔法屬界""。"
半人馬世界,一匹無畏的戰馬踏上尋找它可靠騎手的旅程，在一個充滿魔法、冒險和歌唱半人馬的奇幻世界中穿行。
鯊魚狗,半鯊魚，半狗，有一顆善良的心，肚子裡裝滿了魚條！鯊狗和他的人類朋友麥克斯一起，可以應付任何荒謬或骯髒的冒險。
風河徑,美國魚類和野生動物管理局的追踪員協助一名新手聯邦調查局特工調查在偏遠的懷俄明保留地上發生的一名少女的謀殺案。
我的女孩2,一位青少女為了寫一篇有關她從未見過但很敬佩的人的文章，和她已故母親的高中朋友談話時，發現了令人驚訝的事情。
強尼測試,一個富有想像力的男孩、他的忠誠狗和兩個熱愛科學的姐妹會掉入多少麻煩呢？嗯，聽起來像是一個挑戰！
鐵道師傅,二戰結束幾十年後，一名仍然心靈受創的士兵意外墜入愛河，並看到一個奇異的巧合將他的過去重新提醒起來。
